{
  "schema_version": "mstr.weight-access-manifest.v1",
  "manifest_id": "T027-weight-access-preflight-frozen",
  "generated_at": "2026-08-26T04:00:00Z",
  "task": "MSTR-000 / T027",
  "canonical_base": "6b5ce9599e4985182113c98f53e8c9566f3b1864",
  "bound": {
    "scope": "Preflight only: freeze exact acquisition identity, integrity expectations, byte budgets, network surface, gating status, retention/cleanup, and cost ceiling for the eight T022-admitted candidates. No weight bodies are fetched, no execution occurs, no runtime/quantizer winner is selected.",
    "do_not": [
      "download .safetensors/.bin/GGUF/checkpoint/adapter weight bodies",
      "execute any model, quantizer, runtime, Colab session, or Unsloth install",
      "accept gated terms or authenticate to any model provider",
      "select a canonical runtime or final quantizer (T029/T030 own that)",
      "start T028 without separate explicit founder authorization"
    ]
  },
  "candidates": [
    {
      "candidate_id": "qwen3.5-2b",
      "role": "foundation",
      "upstream_repository": "https://huggingface.co/Qwen/Qwen3.5-2B-Base",
      "exact_model_id": "Qwen/Qwen3.5-2B-Base",
      "exact_revision": "b1485b2fa6dfa1287294f269f5fb618e03d52d7c",
      "revision_verified_at": "2026-08-26T04:00:00Z (live metadata HTTPS GET during T027 preflight)",
      "artifact_source_hosts": [
        "huggingface.co"
      ],
      "required_artifact_files": [
        "LICENSE",
        "README.md",
        "config.json",
        "merges.txt",
        "model.safetensors-00001-of-00001.safetensors",
        "model.safetensors.index.json",
        "tokenizer.json",
        "tokenizer_config.json",
        "vocab.json"
      ],
      "optional_artifact_files": [
        "preprocessor_config.json",
        "video_preprocessor_config.json"
      ],
      "explicitly_forbidden_artifacts": [
        "*.gguf",
        "*.pt",
        "*.pth",
        "*.ckpt",
        "adapter_model.*",
        "training checkpoints"
      ],
      "tokenizer_files": [
        "merges.txt",
        "tokenizer.json",
        "tokenizer_config.json",
        "vocab.json"
      ],
      "processor_or_config_files": [
        "config.json",
        "model.safetensors.index.json",
        "preprocessor_config.json",
        "video_preprocessor_config.json"
      ],
      "weight_format": "bf16 safetensors (sharded per model.safetensors.index.json where present)",
      "expected_total_download_bytes": 4571203846,
      "expected_total_storage_bytes": 4571203846,
      "temporary_storage_ceiling": 4571203846,
      "expected_file_integrity": [
        {
          "file": "LICENSE",
          "expected_size_bytes": 11343,
          "upstream_sha256": null
        },
        {
          "file": "README.md",
          "expected_size_bytes": 3721,
          "upstream_sha256": null
        },
        {
          "file": "config.json",
          "expected_size_bytes": 2908,
          "upstream_sha256": null
        },
        {
          "file": "merges.txt",
          "expected_size_bytes": 3353259,
          "upstream_sha256": null
        },
        {
          "file": "model.safetensors-00001-of-00001.safetensors",
          "expected_size_bytes": 4548221488,
          "upstream_sha256": "928acbf11878c32185bbd863514d191769285065ab9ea14fbfe431303f5fdf2d"
        },
        {
          "file": "model.safetensors.index.json",
          "expected_size_bytes": 64460,
          "upstream_sha256": null
        },
        {
          "file": "tokenizer.json",
          "expected_size_bytes": 12807196,
          "upstream_sha256": "fe000e3ed39ed12b8d2481d527d44f93c65d37e87645d2dcc80d1bf9d50d2927"
        },
        {
          "file": "tokenizer_config.json",
          "expected_size_bytes": 16712,
          "upstream_sha256": null
        },
        {
          "file": "vocab.json",
          "expected_size_bytes": 6722759,
          "upstream_sha256": null
        }
      ],
      "post_download_sha256_verification_requirement": "Every downloaded weight file MUST hash-match its declared LFS OID SHA-256 from expected_file_integrity before admission to T028 verification; mismatch quarantines the file and fails that candidate closed.",
      "artifact_manifest_verification_method": "T028 emits an mstr.artifact.v1 manifest (ArtifactFileEntry: relative_path+sha256+size) verified offline via mstr_qualify.artifacts.verify_artifact against the acquired external directory.",
      "T024_verifier_compatibility": "COMPATIBLE \u2014 T024 verify_artifact accepts exact per-file SHA-256 + size identity; expected_file_integrity supplies the upstream side of that comparison.",
      "runtime_candidates": [
        "llama.cpp-GGUF-class CPU runtime",
        "llamafile-portable-class runner"
      ],
      "quantizer_candidates": [
        "llama.cpp convert_hf_to_gguf + llama-quantize Q4-class recipe"
      ],
      "runtime_quantizer_status": "CANDIDATE_ONLY_NEEDS_T029_T030",
      "network_hosts_required_for_acquisition": [
        "huggingface.co"
      ],
      "network_method": "HTTPS_GET_ONLY",
      "authentication_required": false,
      "account_required": false,
      "gated_access": false,
      "clickthrough_required": false,
      "terms_acceptance_required": false,
      "license_identity": "Apache-2.0 (declared at pinned revision)",
      "license_evidence_url": "https://huggingface.co/Qwen/Qwen3.5-2B-Base/blob/b1485b2fa6dfa1287294f269f5fb618e03d52d7c/README.md",
      "rights_decision": "READY_FOR_T028",
      "rights_decision_evidence": "Apache-2.0 confirmed live at pinned revision: HF tag 'license:apache-2.0', README front matter, and verbatim LICENSE file present in tree.",
      "license_reverification_timestamp": "2026-08-26T04:00:00Z",
      "storage_budget": {
        "download_bytes_expected": 4571203846,
        "on_disk_bytes_expected": 4571203846,
        "temporary_bytes_expected": 0
      },
      "retention_policy": "Acquired artifacts persist in the external acquisition directory until T034 local-artifact admission closes; candidates rejected at T034 are retained only if referenced by open review evidence, else deleted.",
      "cleanup_policy": "Any partial or integrity-failed download is deleted immediately; successful artifacts are never mutated in place (re-acquire instead).",
      "cache_policy": "No shared provider cache is populated; direct-to-final-path streaming keeps peak storage equal to final storage.",
      "artifact_location_policy": "All binaries live outside Git under artifacts/external/<candidate_id>/ (gitignored); manifests and evidence stay inside Git.",
      "git_exclusion_policy": "artifacts/external/, models/, downloads/, *.safetensors, *.gguf, *.pt, *.pth, *.onnx are already covered by .gitignore; T028 must not weaken these rules.",
      "cost_ceiling": "USD 0.00 \u2014 any payment requirement aborts toward T028 with PAID_ACCESS_REQUIRES_NEW_FOUNDER_DECISION.",
      "expected_monetary_cost": "USD 0.00",
      "expected_download_storage_aggregate": "4,571,203,846 bytes download / 4,571,203,846 bytes final on disk (~4.26 GiB); optional files add 776 bytes",
      "failure_behavior": "A failed or integrity-mismatched download halts only that candidate, deletes partials, records EXCLUDED_ARTIFACT_UNRESOLVED in T028 output; other candidates proceed. No substitute revision is ever fetched silently.",
      "recommendation": "READY_FOR_T028",
      "runtime_quantizer_license_notes": "Runtime candidates: llama.cpp-GGUF-class CPU runtime and llamafile-portable-class runner \u2014 both are MIT-licensed open-source tools with unrestricted commercial use; quantizer candidates: llama.cpp convert_hf_to_gguf + llama-quantize Q4-class recipe (MIT, same project identity). Preliminary dependency-rights record: binding evaluation deferred to T029/T030, where exact upstream source, pinned build/version, verified license text, and commercial-use determination for each tool are evaluated independently. No runtime or quantizer is selected here."
    },
    {
      "candidate_id": "qwen3.5-4b",
      "role": "foundation",
      "upstream_repository": "https://huggingface.co/Qwen/Qwen3.5-4B-Base",
      "exact_model_id": "Qwen/Qwen3.5-4B-Base",
      "exact_revision": "1001bb4d826a52d1f399e183466143f4da7b741b",
      "revision_verified_at": "2026-08-26T04:00:00Z (live metadata HTTPS GET during T027 preflight)",
      "artifact_source_hosts": [
        "huggingface.co"
      ],
      "required_artifact_files": [
        "LICENSE",
        "README.md",
        "config.json",
        "merges.txt",
        "model.safetensors-00001-of-00002.safetensors",
        "model.safetensors-00002-of-00002.safetensors",
        "model.safetensors.index.json",
        "tokenizer.json",
        "tokenizer_config.json",
        "vocab.json"
      ],
      "optional_artifact_files": [
        "preprocessor_config.json",
        "video_preprocessor_config.json"
      ],
      "explicitly_forbidden_artifacts": [
        "*.gguf",
        "*.pt",
        "*.pth",
        "*.ckpt",
        "adapter_model.*",
        "training checkpoints"
      ],
      "tokenizer_files": [
        "merges.txt",
        "tokenizer.json",
        "tokenizer_config.json",
        "vocab.json"
      ],
      "processor_or_config_files": [
        "config.json",
        "model.safetensors.index.json",
        "preprocessor_config.json",
        "video_preprocessor_config.json"
      ],
      "weight_format": "bf16 safetensors (sharded per model.safetensors.index.json where present)",
      "expected_total_download_bytes": 9342822405,
      "expected_total_storage_bytes": 9342822405,
      "temporary_storage_ceiling": 9342822405,
      "expected_file_integrity": [
        {
          "file": "LICENSE",
          "expected_size_bytes": 11343,
          "upstream_sha256": null
        },
        {
          "file": "README.md",
          "expected_size_bytes": 3722,
          "upstream_sha256": null
        },
        {